{
  "slug": "2026-03-15-icons",
  "name": "App icon exploration",
  "goal": "Evaluate three icon concepts",
  "createdAt": "2026-03-15T10:00:00.000Z",
  "updatedAt": "2026-03-15T10:00:00.000Z",
  "status": "decided",
  "tags": ["icons", "branding"],
  "supersededBy": null,
  "decision": {
    "file": "icon-b.html",
    "decidedAt": "2026-03-16T14:00:00.000Z",
    "note": "Unanimous pick"
  }
}
